Id,PersonId,Name,MetadataDateSent,clean_email,raw_email,scores_nltk,pred_nltk,scores_TextBlob,pred_TextBlob,same,topic,topic_0,topic_1,topic_2
2179,81,Huma Abedin,2009-12-23T05:00:00+00:00,Will get speech soon Can yo fax it to house,Will I get speech soon? Can yo fax it to house?,0.0,neutural,0.0,neutural,1.0,topic_1,0.10896025204176156,0.7818869303868251,0.1091528175714132
2184,180,Richard Verma,2009-12-23T05:00:00+00:00,PIs print,PIs print.,0.0,neutural,0.0,neutural,1.0,topic_2,0.15472802800228586,0.3671173537312177,0.4781546182664964
2187,81,Huma Abedin,2009-12-23T05:00:00+00:00,Importance Thursday January AM Fw Lewis Work Plan Lewis Department Noticedocx Lewis Work Plandocx Lewis Department Noticedocx Lewis Work Plandocx High Pls print,"Importance: H <hrod17@clintonemail.com> Thursday, January 7, 2010 6:52 AM 'JilotyLC@state.gov' Fw: 2009-12-31 Lewis Work Plan 2009-12-31 Lewis Department Notice.docx; 2009-12-31 Lewis Work Plan.docx; 2009-12-31 Lewis Department Notice.docx; 2009-12-31 Lewis Work Plan.docx High Pls print.",0.4215,positive,0.16,positive,1.0,topic_1,0.15221589259688556,0.6874132142733563,0.16037089312975816
2191,81,Huma Abedin,2009-12-23T05:00:00+00:00,Ok Is Raj coming tonight,Ok. Is Raj coming tonight?,0.29600000000000004,positive,0.5,positive,1.0,topic_1,0.11360329445249245,0.7688712978516661,0.11752540769584152
2192,81,Huma Abedin,2009-12-23T05:00:00+00:00,want to send the development speech as delivered note from me to the appropriate Members of Congress authorizing appropriating leadership others can sign the letters anytime before leave for AsiaPacific on Monday am Thx so much,"I want to send the development speech as delivered w a note from me to the appropriate Members of Congress (authorizing, appropriating, leadership, others?). I can sign the letters anytime before I leave for Asia/Pacific on Monday am. Thx so much.",0.3818,positive,0.35,positive,1.0,topic_1,0.07757825253628738,0.683047941191103,0.2393738062726096
2194,81,Huma Abedin,2009-12-23T05:00:00+00:00,We should try to reschedule call The press statements explain lot,We should try to reschedule call. The press statements explain a lot.,0.0,neutural,0.0,neutural,1.0,topic_0,0.4980395308849004,0.10255943764795614,0.3994010314671434
2195,81,Huma Abedin,2009-12-23T05:00:00+00:00,We should try,We should try.,0.0,neutural,0.0,neutural,1.0,topic_0,0.6505743604867565,0.178358409688813,0.17106722982443046
2197,81,Huma Abedin,2009-12-23T05:00:00+00:00,Can you also put people on domestic radio including talk shows getting out info and answering questions,"Can you also put people on domestic radio, including talk shows getting out info and answering questions?",0.0,neutural,0.0,neutural,1.0,topic_0,0.651936164927182,0.25276714956107843,0.0952966855117396
2200,171,Phillip Crowley,2009-12-23T05:00:00+00:00,Sen Tester Pls ask someone on Michele Bonds team to call Jamie Wise on Sen Testers staff to explain our orphan procedures The Senator said he had about families who had gone thru the adoption process Pls add Stephanie Miner and Jack Mannion to guest list for future event at State Also Jack Rosen still wants mtg sometime in the future So ask Lona just to add him to list but not schedule it,"Sen. Tester--Pls ask someone on Michele Bond's team to call Jamie Wise on Sen. Tester's staff to explain our orphan procedures. The Senator said he had about 15 families who had gone thru the adoption process. Pls add Stephanie Miner and Jack Mannion to a guest list for a future event at State. Also, Jack Rosen still wants a mtg sometime in the future. So ask Lona just to add him to a list but not schedule it.",0.3291,positive,0.225,positive,1.0,topic_0,0.7052053431852752,0.07619552987330412,0.2185991269414206
2201,32,Cheryl Mills,2009-12-23T05:00:00+00:00,Wednesday January PM Re Morales,"H <hrod17@clintonemail.com> Wednesday, January 20, 20108:36 PM 'sullivanjj@state.gov' Re: Morales",0.0,neutural,0.0,neutural,1.0,topic_1,0.1149233973062422,0.7667580873473424,0.1183185153464153
2204,113,Kurt Campbell,2009-12-23T05:00:00+00:00,Do you know when it will arrive,Do you know when it will arrive?,0.0,neutural,0.0,neutural,1.0,topic_1,0.1445899554445603,0.5580165889363798,0.2973934556190598
2206,87,Jake Sullivan,2009-12-23T05:00:00+00:00,Wednesday January PM Re Speech ETA Thank you TT for very good speech have few questions Also pls be sure the text is carefully proofread since there are number of typos and missing words,"H <hrod17@clintonemail.com> Wednesday, January 20, 2010 10:30 PM 'sullivanjj@state.gov'; 'tillemnants@state.gov' Re: Speech ETA? Thank you TT for a very good speech. I have a few questions: Also, pls be sure the text is carefully proofread since there are a number of typos and missing words.",0.7841,positive,0.182,positive,1.0,topic_0,0.6088609746236991,0.24304838037260515,0.1480906450036956
2211,81,Huma Abedin,2009-12-23T05:00:00+00:00,Jake Whats your take on the impact of this version,Jake-- What's your take on the impact of this version?,0.0,neutural,0.0,neutural,1.0,topic_1,0.12719939346910578,0.7482121279132375,0.12458847861765672
2212,81,Huma Abedin,2009-12-23T05:00:00+00:00,Do you have his email address The email sent to you both came back undelivered,Do you have his email address? The email I sent to you both came back undelivered.,0.0,neutural,0.0,neutural,1.0,topic_1,0.10847846352165966,0.7821497634905529,0.10937177298778744
2214,81,Huma Abedin,2009-12-23T05:00:00+00:00,Id like to invite two EUR staffers Jeremy Shapiro and Siddharth Mohandas who wrote good memo about US EU to come by and meet Lady Ashton tomorrow Or even sit in on the mtg if ok Phil Gordon,I'd like to invite two EUR staffers--Jeremy Shapiro and Siddharth Mohandas-- who wrote a good memo about US-EU to come by and meet Lady Ashton tomorrow. Or even sit in on the mtg if ok w Phil Gordon.,0.802,positive,0.6,positive,1.0,topic_0,0.48722619711122206,0.4060904625382664,0.10668334035051162
2231,32,Cheryl Mills,2009-12-24T05:00:00+00:00,Let me know what you find out Probably need to talk Bader and Froman too,Let me know what you find out. Probably need to talk w Bader and Froman too.,0.0,neutural,0.0,neutural,1.0,topic_1,0.10413954516346556,0.7436345150023275,0.15222593983420699
2233,32,Cheryl Mills,2009-12-24T05:00:00+00:00,Pls print Friday January AM Fw early review Sid,"Pls print. H <hrod17@clintonemail.corn> Friday, January 22, 2010 6:14 AM 'JilotyLC@state.gov' Fw: H: early review. Sid",0.0772,positive,0.1,positive,1.0,topic_1,0.08848024459385026,0.8226168621276013,0.0889028932785484
2237,180,Richard Verma,2009-12-23T05:00:00+00:00,Another good idea,Another good idea.,0.4404,positive,0.7,positive,1.0,topic_2,0.1390018699522284,0.14078888382807686,0.7202092462196946
2238,180,Richard Verma,2009-12-24T05:00:00+00:00,Importance High Pls print,Importance: High Pls print.,0.4215,positive,0.16,positive,1.0,topic_2,0.11740422733741038,0.4098303160865031,0.4727654565760866
2239,180,Richard Verma,2009-12-24T05:00:00+00:00,Shall we wait until we make decisions,Shall we wait until we make decisions,0.0,neutural,0.0,neutural,1.0,topic_0,0.7413333799668085,0.12321594397784613,0.13545067605534536
2242,180,Richard Verma,2009-12-24T05:00:00+00:00,imagejpg As predicted,image003.jpg As predicted.,0.0,neutural,0.0,neutural,1.0,topic_1,0.13943628945541112,0.7173387610078172,0.14322494953677178
2246,81,Huma Abedin,2009-12-24T05:00:00+00:00,The idea of statement as requested below is good one,The idea of a statement as requested below is a good one.,0.4404,positive,0.7,positive,1.0,topic_2,0.14303199139145,0.11619328286957255,0.7407747257389774
2251,32,Cheryl Mills,2009-12-26T05:00:00+00:00,just tried calling but couldnt find her Im on way home,I just tried calling but couldn't find her. I'm on way home.,0.0,neutural,0.0,neutural,1.0,topic_2,0.3873794215871839,0.12400799265505474,0.4886125857577614
2252,81,Huma Abedin,2009-12-26T05:00:00+00:00,TT As prepared Thank you for all you did to make the speech yesterday so effective and powerful Weve gotten many positive comments and laid solid foundation for future action Please get caught up on sleep All the best Hillary,"TT (As prepared)--Thank you for all you did to make the speech yesterday so effective and powerful. We've gotten many positive comments and laid a solid foundation for future action. Please get caught up on sleep! All the best, Hillary",0.9689,positive,0.3409090909090909,positive,1.0,topic_2,0.07454999273589401,0.07057710986623546,0.8548728973978705
2256,145,Michael Posner,2009-12-28T05:00:00+00:00,prefer and they can all stay the next day for meetings if possible,I prefer (1) and they can all stay the next day for meetings if possible.,0.0,neutural,0.0,neutural,1.0,topic_0,0.5592719534841347,0.11534660256386295,0.3253814439520023
2274,87,Jake Sullivan,2009-12-28T05:00:00+00:00,PJ Thanks for the headsup about question was not saying anything new and believe have said this before and am copying both Philippe and Jake so all three of you can help me remember when where and whether Also believe the POTUS has also said this Lets discuss tomorrow,"P.J.---Thanks for the headsup about question. I was not saying anything new and believe I have said this before and am copying both Philippe and Jake so all three of you can help me remember when, where and whether. Also, I believe the POTUS has also said this. Let's discuss tomorrow.",0.6808,positive,0.16818181818181818,positive,1.0,topic_1,0.09216867109129827,0.8128739038538414,0.0949574250548604
2308,81,Huma Abedin,2009-12-29T05:00:00+00:00,What is evidence that this group sponsored it,What is evidence that this group sponsored it?,0.0,neutural,0.0,neutural,1.0,topic_0,0.7535963073795251,0.12310870844731213,0.12329498417316287
2315,86,Jacob Lew,2009-12-29T05:00:00+00:00,Thursday February PM Fw URGENT GOOD NEWs ON NI Sid Fyi So need to do press early starting by,"H <hrod17@clintonemail.com> Thursday, February 4, 2010 7:06 PM 'sullivanjj@state.gov' Fw: URGENT GOOD NEWs ON NI!!!! Sid Fyi. So I need to do press early starting by 9.",0.7885,positive,0.26666666666666666,positive,1.0,topic_1,0.07338362383112065,0.828776307039304,0.09784006912957532
2317,86,Jacob Lew,2009-12-29T05:00:00+00:00,Thursday February PM sbwhoeop Re URGENT GOOD NEWs ON NI Sid That is wonderful Kudos to Gordon and Shaun,"H <hrod17@clintonemail.com > Thursday, February 4, 2010 7:09 PM 'sbwhoeop Re: URGENT GOOD NEWs ON NI!!!! Sid B6 That is wonderful! Kudos to Gordon and Shaun.",0.9211,positive,0.85,positive,1.0,topic_1,0.07525878909319128,0.8446903295983884,0.08005088130842034
2320,87,Jake Sullivan,2009-12-29T05:00:00+00:00,How would you frame the relevance Im copying Jake Sullivan who works me on this,How would you frame the relevance? I'm copying Jake Sullivan who works w me on this.,0.0,neutural,0.0,neutural,1.0,topic_1,0.10017574264723253,0.7976374995726285,0.10218675778013887
2329,32,Cheryl Mills,2009-12-29T05:00:00+00:00,Saturday January PM sbwhoeop Re FYI Any foreign nation or leader with front company becomes person under US law Good for him wish he were instead,"H <hrod17@clintonemail.com > Saturday, January 23, 2010 4:09 PM 'sbwhoeop Re: H: FYI: Any foreign nation or leader with a front company becomes a ""person"" under US law. S Good for him. I wish he were 50 instead 90!",0.7983,positive,0.2875,positive,1.0,topic_1,0.07432059774609602,0.8475754081597604,0.07810399409414367
2330,32,Cheryl Mills,2009-12-29T05:00:00+00:00,They did,They did.,0.0,neutural,0.0,neutural,1.0,topic_0,0.3333333333333333,0.3333333333333333,0.3333333333333333
2353,32,Cheryl Mills,2009-12-29T05:00:00+00:00,Reaction Friday February AM Fw Bravo Brava Issue your statement Sid,"Reaction? H <hrod17@clintonemail.com> Friday, February 5, 2010 7:13 AM 'sullivanjj@state.gov' Fw: Bravo! Brava! Issue your statement! Sid",0.0,neutural,0.0,neutural,1.0,topic_1,0.08571194708880894,0.7473584786119153,0.16692957429927574
2354,32,Cheryl Mills,2009-12-29T05:00:00+00:00,Friday February AM preines Huma Abedin Witten statement now Id like to be first statement on behalf of USG Can we do asap and then repeat on camera,"H <hrod17@clintonemail.com> Friday, February 5, 2010 7:15 AM 'sullivanjj@state.gov'; 'preines ; Huma Abedin B6 Witten statement now? I'd like to be first w statement on behalf of USG. Can we do asap and then repeat on camera?",0.3612,positive,0.25,positive,1.0,topic_2,0.07890130125547196,0.41261405903085097,0.508484639713677
2356,87,Jake Sullivan,2009-12-29T05:00:00+00:00,RELEASE IN PART BB,"RELEASE IN PART B5,B6",0.0,neutural,0.0,neutural,1.0,topic_2,0.14258773048669124,0.14071970447357005,0.7166925650397388
2357,32,Cheryl Mills,2009-12-30T05:00:00+00:00,What can we do,What can we do?,0.0,neutural,0.0,neutural,1.0,topic_0,0.3333333333333333,0.3333333333333333,0.3333333333333333
2358,32,Cheryl Mills,2009-12-31T05:00:00+00:00,Are you getting ready to leave,Are you getting ready to leave?,0.3182,positive,0.2,positive,1.0,topic_1,0.15107457987018255,0.7034367265720396,0.14548869355777788
3155,112,Kris Balderston,2009-11-05T05:00:00+00:00,know So are you there or leaving now Id love to talk you and Bill,I know! So are you there or leaving now? I'd love to talk w you and Bill.,0.6369,positive,0.5,positive,1.0,topic_2,0.12989620135101032,0.4020595228351511,0.4680442758138387
3155,156,Nora Toiv,2009-11-05T05:00:00+00:00,you Ok at,you? Ok at 10:30.,0.29600000000000004,positive,0.5,positive,1.0,topic_1,0.16670708093985628,0.6665908045641527,0.166702114495991
3983,194,Sidney Blumenthal,2010-02-15T05:00:00+00:00,you Is there call sheet,you? Is there a call sheet?,0.0,neutural,0.0,neutural,1.0,topic_1,0.16701793555069602,0.6660355636146705,0.16694650083463355
3983,428,sbwhoeopi,2010-02-15T05:00:00+00:00,Ok Im done Strobe Also lets go on our trip think its worth it And we can alWays add Israel as we did before,Ok I'm done w Strobe. Also let's go on our trip. I think it's worth it. And we can alWays add Israel as we did before!,0.4767,positive,0.4,positive,1.0,topic_2,0.1038112274994729,0.2199038853958929,0.6762848871046342
5416,194,Sidney Blumenthal,2010-05-07T04:00:00+00:00,dont have call sheets for Lobo or Equadoran Can you send on my email,I don't have call sheets for Lobo or Equadoran. Can you send on my email.,0.0,neutural,0.0,neutural,1.0,topic_1,0.10556292929968926,0.7862581862142313,0.10817888448607944
6542,32,Cheryl Mills,2010-01-07T05:00:00+00:00,Getting it,Getting it.,0.0,neutural,0.0,neutural,1.0,topic_0,0.3333333333333333,0.3333333333333333,0.3333333333333333
6557,60,Doug Hattaway,2010-01-10T05:00:00+00:00,Ok Can we do now,Ok. Can we do now?,0.29600000000000004,positive,0.5,positive,1.0,topic_1,0.16670708093985628,0.6665908045641527,0.166702114495991
6559,124,Lona Valmoro,2010-01-10T05:00:00+00:00,docx Fyi Can you determine when Shaun wants to talk,020610.docx Fyi. Can you determine when Shaun wants to talk?,0.2023,positive,0.2,positive,1.0,topic_1,0.2264170128615,0.6685047672044837,0.1050782199340163
6564,112,Kris Balderston,2010-01-10T05:00:00+00:00,Of course will do Is the text set,Of course I will do. Is the text set?,0.0,neutural,0.0,neutural,1.0,topic_2,0.12568005262021192,0.1340778839829461,0.7402420633968421
6567,116,Lauren Jiloty,2010-01-11T05:00:00+00:00,Can we do in morning What time works for you,Can we do in morning? What time works for you?,0.0,neutural,0.0,neutural,1.0,topic_1,0.12434792275674725,0.7413691394556328,0.13428293778762004
6569,112,Kris Balderston,2010-01-11T05:00:00+00:00,Im happy to talk Shaun anytime,I'm happy to talk w Shaun anytime.,0.5719,positive,0.8,positive,1.0,topic_2,0.1130675139111595,0.21878548096484013,0.6681470051240003
6577,32,Cheryl Mills,2010-01-11T05:00:00+00:00,When the snow melts Id love to hear what he had to say,"When the snow melts, I'd love to hear what he had to say!",0.6369,positive,0.5,positive,1.0,topic_2,0.1249735889985522,0.11503848406324095,0.7599879269382067
6578,81,Huma Abedin,2010-01-12T05:00:00+00:00,Pls be sure Bill and do letter to for his marriage in June And pls put the following on my call list Alston Johnson Francis Collins Derek Harvey he came into see me in the Senate Paul Charron Lisa Caputo Marty Edelman,Pls be sure Bill and I do a letter to for his marriage in June. B6 And pls put the following on my call list: Alston Johnson Francis Collins Derek Harvey (he came into see me in the Senate) Paul Charron Lisa Caputo Marty Edelman,0.4404,positive,0.25,positive,1.0,topic_2,0.13830905156479031,0.08052631583881845,0.7811646325963912
6578,408,hume abedin,2010-01-12T05:00:00+00:00,Good on all counts Are you at Super Bowl party,Good on all counts! Are you at a Super Bowl party?,0.8591,positive,0.5166666666666666,positive,1.0,topic_2,0.1197902768088115,0.11062554385980318,0.7695841793313853
6578,116,Lauren Jiloty,2010-01-12T05:00:00+00:00,Not surprising assessment from Embassy,Not a surprising assessment from Embassy.,-0.2057,negative,-0.35,negative,1.0,topic_2,0.12535570370024285,0.13398472978965434,0.7406595665101028
6580,112,Kris Balderston,2010-01-12T05:00:00+00:00,Ok can also talk after the Lavrov call,Ok. I can also talk after the Lavrov call.,0.29600000000000004,positive,0.5,positive,1.0,topic_1,0.1254820969183801,0.7324940649033898,0.14202383817823006
6591,66,Esther Brimmer,2010-01-14T05:00:00+00:00,Did EUR get memcon of my call Westerwelle,Did EUR get memcon of my call w Westerwelle?,0.0,neutural,0.0,neutural,1.0,topic_0,0.7511744893324285,0.12464645849587287,0.12417905217169856
6593,116,Lauren Jiloty,2010-01-14T05:00:00+00:00,But just heard that federal agencies will be closed again tomorrow What are we doing to avoid or win the EP vote on,But I just heard that federal agencies will be closed again tomorrow! What are we doing to avoid or win the EP vote on 2/11?,0.3818,positive,0.35000000000000003,positive,1.0,topic_0,0.7486604540789591,0.15407365363963976,0.09726589228140124
6596,116,Lauren Jiloty,2010-01-14T05:00:00+00:00,wouldnt have closed the govt again tomorrow but once the decision was made it is difficult to operate inside the Building since so many staff will stay away So lets work from home again,"I wouldn't have closed the govt again tomorrow but once the decision was made, it is difficult to operate inside the Building since so many staff will stay away. So let's work from home--again!",-0.5023,negative,-0.033333333333333326,negative,1.0,topic_0,0.5963787742728579,0.10674191650217067,0.29687930922497124
6616,32,Cheryl Mills,2010-01-14T05:00:00+00:00,more read all the way down and am very concerned but not surprised Have you shared the content Bill What do you think should be done and by whom to address these issues,more I read all the way down and am very concerned but not surprised. Have you shared the content w Bill? What do you think should be done--and by whom--to address these issues?,0.2734,positive,0.12361111111111113,positive,1.0,topic_1,0.08807528485523007,0.8177670996398609,0.09415761550490906
6616,475,rshal,2010-01-14T05:00:00+00:00,Sunday January AM Huma Abedin Re Yang,"H <hrod17@clintonemail.com> Sunday, January 24, 2010 10:49 AM Huma Abedin 'sullivanjj@state.gov' Re: Yang",0.0,neutural,0.0,neutural,1.0,topic_2,0.10587901547212188,0.3497793609816747,0.5443416235462035
6619,32,Cheryl Mills,2010-01-14T05:00:00+00:00,am so sorry we lost him Ed Rendell told me he wants to hold big memorial service in the State Capitol in Harrisburg but he hasnt spoken to Joyce yet havent either Id like to go too wherever it is Let me know what you hear Also since the govt is closed again tomorrow and Congress cancelled too and another big storm is expected tomorrow night do you think Congress will even bother showing up for our hearings Im planning on working from home,"I am so sorry we lost him. Ed Rendell told me he wants to hold a big memorial service in the State Capitol in Harrisburg but he hasn't spoken to Joyce yet. I haven't either. I'd like to go too wherever it is. Let me know what you hear. Also, since the govt is closed again tomorrow and Congress cancelled too, and another big storm is expected tomorrow night, do you think Congress will even bother showing up for our hearings? I'm planning on working from home.",-0.8535,negative,-0.08333333333333333,negative,1.0,topic_2,0.05897184185367538,0.15546766552449506,0.7855604926218297
6625,81,Huma Abedin,2010-01-15T05:00:00+00:00,Remind me who Bob McGuire is,Remind me who Bob McGuire is.,0.0,neutural,0.0,neutural,1.0,topic_1,0.125324797031685,0.7517717086163331,0.1229034943519819
6628,81,Huma Abedin,2010-01-15T05:00:00+00:00,Who thought Eikenberry,Who? I thought Eikenberry.,0.0,neutural,0.0,neutural,1.0,topic_1,0.14239494023759006,0.7140150672096175,0.1435899925527926
6628,32,Cheryl Mills,2010-01-15T05:00:00+00:00,just saw an article he wrote in USA Weekend claiming we had FOX on our airplane screens What is he talking about He makes big deal out of it,I just saw an article he wrote in USA Weekend claiming we had FOX on our airplane screens. What is he talking about? He makes a big deal out of it.,0.0,neutural,0.0,neutural,1.0,topic_2,0.08205182429417864,0.09095326805733524,0.8269949076484862
6629,81,Huma Abedin,2010-01-15T05:00:00+00:00,Tuesday February AM preines Huma Abedin cherylmills David Brooks Took shot at me in his column today Any ideas what prompted it,"H <hrod17@clintonemail.com > Tuesday, February 9, 2010 7:39 AM 'preines 'sullivanjj@state.gov' B6 Huma Abedin 'cheryl.mills David Brooks Took a shot at me in his column today. Any ideas what prompted it?",0.0,neutural,0.0,neutural,1.0,topic_2,0.07688115716022541,0.2517614689359157,0.671357373903859
6629,32,Cheryl Mills,2010-01-15T05:00:00+00:00,But why did he make such big deal out of it And what did say when he asked,But why did he make such a big deal out of it? And what did I say when he asked?,0.0,neutural,0.0,neutural,1.0,topic_2,0.1259047797420112,0.12850422146217216,0.7455909987958167
6631,32,Cheryl Mills,2010-01-15T05:00:00+00:00,What is Eric Scwarzs email,What is Eric Scwarz's email?,0.0,neutural,0.0,neutural,1.0,topic_1,0.1253358233258629,0.7491032308659099,0.12556094580822713
6633,32,Cheryl Mills,2010-01-15T05:00:00+00:00,Whos Jim,Who's Jim?,0.0,neutural,0.0,neutural,1.0,topic_2,0.16809593461861067,0.16689474326606446,0.6650093221153249
6634,32,Cheryl Mills,2010-01-17T05:00:00+00:00,Really good ideas But remind me who McGuire is,Really good ideas. But remind me who McGuire is.,0.4927,positive,0.7,positive,1.0,topic_1,0.114389459096179,0.5497245435860203,0.3358859973178007
6635,286,cheryl.mill,2010-01-17T05:00:00+00:00,Thx so much,Thx so much.,0.3612,positive,0.2,positive,1.0,topic_0,0.6265132904516416,0.1929807498817038,0.18050595966665456
6635,174,Rajiv Shah,2010-01-17T05:00:00+00:00,For Claire the special assistants and Joe,"For Claire, the special assistants and Joe?",0.4019,positive,0.35714285714285715,positive,1.0,topic_0,0.7739199110584088,0.1120699593031324,0.11401012963845865
6637,32,Cheryl Mills,2010-01-17T05:00:00+00:00,Ok Im forwarding you more background from Shaun via Sid,Ok. I'm forwarding you more background from Shaun via Sid.,0.29600000000000004,positive,0.5,positive,1.0,topic_1,0.10656426520529096,0.4475141656321391,0.44592156916256986
6638,32,Cheryl Mills,2010-01-17T05:00:00+00:00,Here it is Also would be good if could start calls now,"Here it is. Also, would be good if I could start calls now.",0.4404,positive,0.7,positive,1.0,topic_2,0.13945201636515625,0.1431083897908925,0.7174395938439513
6639,81,Huma Abedin,2010-01-17T05:00:00+00:00,Of course will send letter and welcome you Im copying Rob Russo so he can work you to draft the letter This is very exciting to DC The closer the better,"Of course. I will send a letter and welcome you, I'm copying Rob Russo so he can work w you to draft the letter. This is very exciting. to DC. The closer the better!",0.6997,positive,0.5633333333333334,positive,1.0,topic_2,0.0784586065743812,0.20234299394200853,0.7191983994836104
6640,81,Huma Abedin,2010-01-17T05:00:00+00:00,want to do dinner but discuss invites me first Thx,I want to do dinner but discuss invites w me first. Thx.,0.5267,positive,0.25,positive,1.0,topic_1,0.1212249094985301,0.7607941595617179,0.11798093093975212
6642,81,Huma Abedin,2010-01-17T05:00:00+00:00,Anything else going on,Anything else going on?,0.0,neutural,0.0,neutural,1.0,topic_0,0.3333333333333333,0.3333333333333333,0.3333333333333333
6643,32,Cheryl Mills,2010-01-17T05:00:00+00:00,What is her family life complexity,What is her family life complexity?,0.0,neutural,0.0,neutural,1.0,topic_2,0.12381253118669246,0.12331494233071798,0.7528725264825895
6647,86,Jacob Lew,2010-01-17T05:00:00+00:00,Later is fine,Later is fine.,0.2023,positive,0.20833333333333331,positive,1.0,topic_2,0.13852034014389,0.13916020516257288,0.7223194546935371
6656,122,Lissa Muscatine,2010-01-17T05:00:00+00:00,Can you call my berry,Can you call my berry?,0.0,neutural,0.0,neutural,1.0,topic_2,0.17687140576034666,0.16694247203356094,0.6561861222060923
6658,144,Michael Fuchs,2010-01-17T05:00:00+00:00,Well as thought this bill has legs and looks like its about to start running Also thought the QDDR would be done much sooner than Fall Lets discuss this weekend,"Well, as I thought, this bill has legs and looks like it's about to start running. Also, I thought the QDDR would be done much sooner than Fall. Let's discuss this weekend.",0.5574,positive,0.2,positive,1.0,topic_2,0.07976952555160749,0.08517226676441357,0.835058207683979
6661,135,Maria Otero,2010-01-17T05:00:00+00:00,Lets discuss Monday,Let's discuss Monday.,0.0,neutural,0.0,neutural,1.0,topic_1,0.12288529390969473,0.6610907389982473,0.21602396709205796
6700,196,Strobe Talbott,2010-01-18T05:00:00+00:00,Thats the result of your leadership and new model of engagement our own people Onward,That's the result of your leadership and a new model of engagement w our own people. Onward!,0.4588,positive,0.36818181818181817,positive,1.0,topic_0,0.8066341422434666,0.0945767524349026,0.09878910532163074
