Id,PersonId,Name,MetadataDateSent,clean_email,raw_email,scores_nltk,pred_nltk,scores_TextBlob,pred_TextBlob,same,topic,topic_0,topic_1,topic_2
6,185,Robert Russo,2012-09-12T04:00:00+00:00,Pis print Wednesday September PM Fw Meet The Right Wing Extremist Behind Anti fvluslim Film That Sparked Deadly Riots From meat Sent Wednesday September PM To Subject Meet The Right Wing Extremist Behind Anti Muslim Film That Sparked Deadly Riots httemaxbiumenthalcommeet the right wing extremist behind anti musiim tihn that sparked deadly riots Sent from my Verizon Wireless LTE DROID US Department of State Case No Doc No Date STATE DEPT PRODUCED TO HOUSE SELECT BENGHAZI COMM SUBJECT TO AGREEMENT ON SENSITIVE INFORMATION REDACTIONS NO FOIA WAIVER STATE CB,"Pis print. -•-...-^ H < hrod17@clintonernailcom> Wednesday, September 12, 2012 2:11 PM °Russorv@state.gov' Fw: Meet The Right-Wing Extremist Behind Anti-fvluslim Film That Sparked Deadly Riots From [meat) Sent: Wednesday, September 12, 2012 01:00 PM To: 11 Subject: Meet The Right Wing Extremist Behind Anti-Muslim Film That Sparked Deadly Riots htte/maxbiumenthal.com12012/09/meet-the-right-wing-extremist-behind-anti-musiim-tihn-that-sparked- deadly-riots/ Sent from my Verizon Wireless 4G LTE DROID U.S. Department of State Case No. F-2015-04841 Doc No. C05739559 Date: 05/13/2015 STATE DEPT. - PRODUCED TO HOUSE SELECT BENGHAZI COMM. SUBJECT TO AGREEMENT ON SENSITIVE INFORMATION & REDACTIONS. NO FOIA WAIVER. STATE-5CB0045251",-0.9531,negative,-0.098015873015873,negative,1.0,topic_0,0.8333769088226716,0.10897018925486238,0.057652901922466124
23,185,Robert Russo,2012-09-12T04:00:00+00:00,Pis print,Pis print.,0.0,neutural,0.0,neutural,1.0,topic_1,0.14334691840098585,0.7136801950298199,0.14297288656919396
34,185,Robert Russo,2012-09-13T04:00:00+00:00,Pis print From Sullivan Jacob mailto Sent Thursday September PM To Subject FW Quick Summary of POTUS Calls to Presidents of Libya and Egypt FYI,"Pis print. From Sullivan, Jacob 3 [mailto:SullivanJJ@state.gov] Sent: Thursday, September 13, 2012 01:25 PM To: I-I Subject: FW: Quick Summary of POTUS Calls to Presidents of Libya and Egypt FYI",0.368,positive,0.08333333333333333,positive,1.0,topic_1,0.2913565302050791,0.6323077418350654,0.07633572795985538
44,87,Jake Sullivan,2011-03-29T04:00:00+00:00,Both Gates and said the same on the Sunday shows,Both Gates and I said the same on the Sunday shows.,0.0,neutural,0.0,neutural,1.0,topic_1,0.14613506376076132,0.7125930191375239,0.14127191710171486
66,87,Jake Sullivan,2011-04-02T04:00:00+00:00,Pis print Wednesday October PM Fw Fwd Benghazi was obamas am call,"Pis print H <hrod17@clintonemail.com> Wednesday, October 3, 2012 12:05 PM 'Russorv@state.gov' Fw: Fwd: Benghazi was obama's 3 am call",0.0,neutural,0.0,neutural,1.0,topic_1,0.19242138763240976,0.7188928545553516,0.08868575781223863
68,185,Robert Russo,2012-09-14T04:00:00+00:00,When is Chris Stevens going,"When is Chris Stevens going? ---,",0.0,neutural,0.0,neutural,1.0,topic_1,0.1406107210102402,0.7202782976559192,0.13911098133384067
71,185,Robert Russo,2012-10-07T04:00:00+00:00,Pis print Friday September PM Fw CNN Belief Blog Prothero,"Pis print. H <hrod17@clintonemail.com> Friday, September 14, 2012 8:56 PM `Russorv@state.gov' Fw: CNN Belief Blog. Prothero",0.0,neutural,0.0,neutural,1.0,topic_2,0.08537307688035403,0.3509424521465924,0.5636844709730535
74,87,Jake Sullivan,2012-10-07T04:00:00+00:00,Pis print,Pis print. ..... ....,0.0,neutural,0.0,neutural,1.0,topic_1,0.14334691840098585,0.7136801950298199,0.14297288656919396
79,81,Huma Abedin,2012-09-15T04:00:00+00:00,Useful insight Pls circulate,Useful insight. Pls circulate.,0.4939,positive,0.3,positive,1.0,topic_2,0.1165096380359796,0.13377992018338325,0.7497104417806372
86,87,Jake Sullivan,2011-04-08T04:00:00+00:00,Can you call me,Can you call me?,0.0,neutural,0.0,neutural,1.0,topic_0,0.3333333333333333,0.3333333333333333,0.3333333333333333
93,150,Monica Hanley,2012-09-15T04:00:00+00:00,approved Will it be picked up call King should be scheduled so keep working Huma will speak to Holder Does he need to speak secure can do either,--I approved. Will it be picked up? --call w King should be scheduled so keep working w Huma --I will speak to Holder. Does he need to speak secure? I can do either.,0.6369,positive,0.4,positive,1.0,topic_2,0.0872355345790237,0.3332874505630736,0.5794770148579026
104,150,Monica Hanley,2012-09-15T04:00:00+00:00,What is Donnas it,What is Donna's it?,0.0,neutural,0.0,neutural,1.0,topic_1,0.16855481518579524,0.6632109987877058,0.1682341860264988
106,87,Jake Sullivan,2012-10-12T04:00:00+00:00,Ok Thx Also are you in DC,"Ok. Thx. Also, are you in DC? ---",0.5719,positive,0.5,positive,1.0,topic_1,0.13194591496615626,0.7410526866577128,0.1270013983761309
113,150,Monica Hanley,2012-09-16T04:00:00+00:00,Ok,Ok. - --,0.29600000000000004,positive,0.5,positive,1.0,topic_1,0.16670708093985628,0.6665908045641527,0.166702114495991
116,150,Monica Hanley,2012-09-16T04:00:00+00:00,Is Dan coming at,Is Dan coming at 9? ----,0.0,neutural,0.0,neutural,1.0,topic_1,0.14180529787328294,0.7166285981470698,0.14156610397964725
130,32,Cheryl Mills,2012-09-16T04:00:00+00:00,have it Or inal Message,"I have it, ---- Or"" inal Message ---",0.0,neutural,0.0,neutural,1.0,topic_0,0.720619783621883,0.13945691922409625,0.13992329715402071
132,32,Cheryl Mills,2012-10-14T04:00:00+00:00,As planned,As planned.... --,0.0,neutural,0.0,neutural,1.0,topic_2,0.16752591725448068,0.16694936389340848,0.6655247188521107
134,87,Jake Sullivan,2011-06-03T04:00:00+00:00,Very nice Can you talk,Very nice. Can you talk?,0.4754,positive,0.78,positive,1.0,topic_0,0.5153043655120639,0.33734877676427377,0.14734685772366213
144,150,Monica Hanley,2012-10-15T04:00:00+00:00,Im at home in NY so just call when and if you can,I'm at home in NY so just call when and if you can.,0.0,neutural,0.0,neutural,1.0,topic_0,0.7179509007024915,0.14161216329434748,0.1404369360031612
158,81,Huma Abedin,2011-08-22T04:00:00+00:00,Pis print Wednesday October PM Fw,Pis print. H <hrod17@clintonemail.com> Wednesday. October 17 2012 5.48 PM B6 Fw: ---,0.0,neutural,0.0,neutural,1.0,topic_1,0.09833445686071676,0.8006803253684552,0.100985217770828
165,160,Oscar Flores,2011-09-03T04:00:00+00:00,Can we arrange shipments of whats requested,Can we arrange shipments of what's requested?,0.0,neutural,0.0,neutural,1.0,topic_0,0.7333114000798749,0.12625923676119835,0.14042936315892673
165,233,oscar flores,2011-09-03T04:00:00+00:00,Pis print Wednesday September PM Fw Fwd Andrew Sullivan with the Hillary love,Pis print. H <hrod17@clintonemail.com> Wednesday. September 19 2012 4:26 PM Fw: Fwd: Andrew Sullivan with the Hillary love,0.6369,positive,0.5,positive,1.0,topic_1,0.080368982026459,0.5892863658164136,0.3303446521571273
179,87,Jake Sullivan,2012-10-25T04:00:00+00:00,Pis print for me,Pis print for me.,0.0,neutural,0.0,neutural,1.0,topic_1,0.14334691840098585,0.7136801950298199,0.14297288656919396
182,160,Oscar Flores,2012-09-22T04:00:00+00:00,just heard an npr report about the CIA station chief in Tripoli sending cable on saying there was no demo etc Do you know about this US Department of State Case No Doc No Date STATE DEPT PRODUCED TO HOUSE SELECT BENGHAZI COMM SUBJECT TO AGREEMENT ON SENSITIVE INFORMATION REDACTIONS NO FOIA WAIVER STATE CB,I just heard an npr report about the CIA station chief in Tripoli sending a cable on 9/12 saying there was no demo etc. Do you know about this? U.S. Department of State Case No. F-2015-04841 Doc No. C05739763 Date: 05/13/2015 STATE DEPT. - PRODUCED TO HOUSE SELECT BENGHAZI COMM. SUBJECT TO AGREEMENT ON SENSITIVE INFORMATION & REDACTIONS. NO FOIA WAIVER. STATE-5CB0045746,-0.5574,negative,-0.033333333333333326,negative,1.0,topic_0,0.8849685468090528,0.05779068755308176,0.05724076563786563
184,150,Monica Hanley,2012-09-23T04:00:00+00:00,Ns print,Ns print.,0.0,neutural,0.0,neutural,1.0,topic_2,0.15237316434570544,0.3343541935279583,0.5132726421263362
193,150,Monica Hanley,2012-09-23T04:00:00+00:00,Pis print,Pis print. ----,0.0,neutural,0.0,neutural,1.0,topic_1,0.14334691840098585,0.7136801950298199,0.14297288656919396
196,150,Monica Hanley,2012-09-23T04:00:00+00:00,Pis print Sunday September PM Fw Thanks,"Pis print. H <hrod17@clintonemail.com› Sunday, September 23, 2012 10.36 PM 'hanieymr@state.gov` Fw: Thanks",0.4404,positive,0.2,positive,1.0,topic_1,0.09708606337177056,0.7137016468618623,0.1892122897663672
199,87,Jake Sullivan,2012-01-05T05:00:00+00:00,Pis print Sunday September PM Fw thanks,"Pis print. H <hrod17@ciintonernail.com> Sunday, September 23, 2012 10:36 PM 'hanleymr@state.gov. Fw: thanks ...",0.4404,positive,0.2,positive,1.0,topic_1,0.09708606337177056,0.7137016468618623,0.1892122897663672
202,32,Cheryl Mills,2012-11-14T05:00:00+00:00,Thursday January PM Re latest intel libyan conflicts leaders militias Sid Thanks as always and Happy New Year,"H <hrod17@clintonemail.com> Thursday January 5 2012 5:22 PM B6 Re: H: latest intel libyan conflicts, leaders & militias. Sid Thanks, as always, and Happy New Year! _",0.6124,positive,0.40909090909090906,positive,1.0,topic_1,0.2938644091700115,0.5889774113144829,0.11715817951550556
226,87,Jake Sullivan,2012-01-23T05:00:00+00:00,US Department of State Case No Doc No Date STATE DEPT PRODUCED TO HOUSE SELECT BENGHAZI COMM SUBJECT TO AGREEMENT ON SENSITIVE INFORMATION REDACTIONS NO FOIA WAIVER RELEASE IN PART BB,"U.S. Department of State Case No. F-2015-04841 Doc No. C05739817 Date: 05/13/2015 STATE DEPT. - PRODUCED TO HOUSE SELECT BENGHAZI COMM. SUBJECT TO AGREEMENT ON SENSITIVE INFORMATION & REDACTIONS. NO FOIA WAIVER. RELEASE IN PART B5,B6",-0.34,negative,-0.033333333333333326,negative,1.0,topic_0,0.8453005863419916,0.06631113707926539,0.08838827657874301
235,124,Lona Valmoro,2012-11-25T05:00:00+00:00,US Department of State Case No Doc No Date STATE DEPT PRODUCED TO HOUSE SELECT BENGHAZI COMM SUBJECT TO AGREEMENT ON SENSITIVE INFORMATION REDACTIONS NO FOIA WAIVER RELEASE IN PART BB,"U.S. Department of State Case No. F-2015-04841 Doc No. C05739823 Date: 05/13/2015 STATE DEPT. - PRODUCED TO HOUSE SELECT BENGHAZI COMM. SUBJECT TO AGREEMENT ON SENSITIVE INFORMATION & REDACTIONS. NO FOIA WAIVER. RELEASE IN PART B5,B6",-0.34,negative,-0.033333333333333326,negative,1.0,topic_0,0.8453005863419916,0.06631113707926539,0.08838827657874301
245,216,William Burns,2012-12-20T05:00:00+00:00,Monday January PM Fw good hetet internal Libya Sid hrc memo libya internal strife cioa Fyi as usual distribute as you determine,"H ehrod17@elintonemail.come Monday, January 23, 2012 1:41 PM 'sullivanjj@state.gov' Fw: H: V good hetet internal Libya. Sid hrc memo libya internal strife 012312.cioa Fyi, as usual distribute as you determine.",0.5719,positive,0.1125,positive,1.0,topic_1,0.17801626295098266,0.7495379973927384,0.0724457396562788
249,201,Thomas Nides,2012-12-20T05:00:00+00:00,Id like to see Molho and Laurene From Valmoro Lona mailto Sent Sunday November AM Eastern Standard Time To Cc Abedin Hume AbedinHstategov Huma Abedin Valmoro Lona gov Subject Schedule MS please find below tomorrows final draft Two items to mention David Hale may ask you to see Issac Molho he is likely in town tomorrow Secondly Laurerie Jobs has asked to see you on Monday or Tuesday She has just returned from overseas travel and would like to check in Thank you Lona am DEPART Private Residence En route State Department drive time minutes am ARRIVE State Department am PRESIDENTIAL DAILY BRIEFING am Secretarys Office am DAILY SENIOR STAFF MEETING am Secretarys Conference Room am MONDAY MEETING wASSISTANT SECRETARIES am Principals Conference Room am PHOTOS am Treaty Room Staff Claire Floor Blue Coats and Families Joel Wiegert and Family departing Staff Heidi Crebo Rediker and Family am OFFICE TIME pm Secretarys Office pm PHOTOS pm Treaty Room Staff Claire Webster University DC Region people th Floor Blue Coats and Families pm DEPART State Department En route White House US Department of State Case No Doc No STATE DEPT PRODUCED TO HOUSE SELECT BENGHAZI COMM Date SUBJECT TO AGREEMENT ON SENSITIVE INFORMATION REDACTIONS NO FOIA WAIVER STATE SCB US Department of State Case No Doc No Date STATE DEPT PRODUCED TO HOUSE SELECT BENGHAZI COMM SUBJECT TO AGREEMENT ON SENSITIVE INFORMATION REDACTIONS NO FOIA WAIVER drive time minutes pm ARRIVE White House pm pm White House Situation Room Contact Caroline Krency Office CLOSED PRESS Note US Pat Kennedy to attend as plus one for State pm DEPART White House En route State Department drive time minutes pm ARRIVE State Department pm OFFICE TIME pm Secretarys Office pm DEPART State Department En route Private Residence drive time minutes pm ARRIVE Private Residence HRC RON Washington DC WJC RON Chappaqua NY Weather Washington DC Mostly sunny Lona Vairrinre Special Assistant to Secretary Hillary Rodham Clinton direct US Department of State Case No Doc No Date STATE DEPT PRODUCED TO HOUSE SELECT BENGHAZI COMM SUBJECT TO AGREEMENT ON SENSITIVE INFORMATION REDACTIONS NO FOIA WAIVER STATE SCB,"I'd like to see Molho and Laurene. .... . .. ._.. From Valmoro, Lona 3 {mailto:ValmoroU@state.gov] Sent: Sunday, November 25, 2012 07:48 AM Eastern Standard Time To: H Cc: Abedin, Hume <AbedinH©state.gov›; Huma Abedin; Valmoro, Lona 3 <Valmoroli@state,gov> Subject: Schedule MS, please find below tomorrow's final draft. Two items to mention — David Hale may ask you to see Issac Molho, he is likely in town tomorrow. Secondly, Laurerie Jobs has asked to see you on Monday or Tuesday. She has just returned from overseas travel and would like to check in Thank you -- Lona 8:25 am DEPART Private Residence En route State Department [drive time: 10 minutes] 8:35 am ARRIVE State Department 8:35 am PRESIDENTIAL DAILY BRIEFING 8:40 am Secretary's Office 8:45 am DAILY SENIOR STAFF MEETING 9.15 am Secretary's Conference Room 9:15 am MONDAY MEETING w/ASSISTANT SECRETARIES 10:00 am Principals Conference Room 7516 10:00 am PHOTOS 10:15 am Treaty Room Staff: Claire 70, Floor ""Blue Coats and Families Joel Wiegert and Family, departing E Staff - Heidi Crebo-Rediker and Family 10:15 am OFFICE TIME 2:00 pm Secretary's Office 2:00 pm PHOTOS 2:15 pm Treaty Room Staff. Claire - Webster University, DC Region (14 people) - 7th Floor ""Blue Coats' and Families 2:25 pm DEPART State Department En route White House U.S. Department of State Case No. F-2015-04841 Doc No. C05739834 STATE DEPT. - PRODUCED TO HOUSE SELECT BENGHAZI COMM. Date: 05/13/2015 SUBJECT TO AGREEMENT ON SENSITIVE INFORMATION & REDACTIONS. NO FOIA WAIVER. STATE-SCB0045808 U.S. Department of State Case No. F-2015-04841 Doc No. C05739834 Date: 05/13/2015 STATE DEPT. - PRODUCED TO HOUSE SELECT BENGHAZI COMM. SUBJECT TO AGREEMENT ON SENSITIVE INFORMATION & REDACTIONS. NO FOIA WAIVER. [drive time: 5 minutes] 2:30 pm ARRIVE White House 2:35 pm B5 3:20 pm White House Situation Room Contact: Caroline Krency Office 202-456-6317, B6 CLOSED PRESS Note: U/S Pat Kennedy to attend as plus one for State. 3:25 pm DEPART White House En route State Department [drive time: 5 minutes], 3:30 pm ARRIVE State Department 3:30 pm OFFICE TIME 6:00 pm Secretary's Office 6:00 pm DEPART State Department En route Private Residence [drive time: 10 minutes] 6:10 pm ARRIVE Private Residence HRC RON Washington, DC WJC RON Chappaqua, NY Weather: Washington, DC: Mostly sunny, 54/39. Lona Vairrinre Special Assistant to Secretary Hillary Rodham Clinton (202) 647-9071 (direct) U.S. Department of State Case No. F-2015-04841 Doc No. C05739834 Date: 05/13/2015 STATE DEPT. - PRODUCED TO HOUSE SELECT BENGHAZI COMM. SUBJECT TO AGREEMENT ON SENSITIVE INFORMATION & REDACTIONS. NO FOIA WAIVER. STATE-SCB0045809",0.7964,positive,0.01886446886446887,positive,1.0,topic_0,0.6929493169506465,0.26420510458677104,0.042845578462582384
258,87,Jake Sullivan,2012-02-21T05:00:00+00:00,Friday January AM Russorvstategov Fw good Intel internal Libya Sid hrc memo libya internal strife dooc Pis print,"H <hrod17@clintonemail.com> Friday, January 27, 2012 7:15 AM 'Russorv©state.gov' Fw: H: V good Intel internal Libya. Sid hrc memo libya internal strife 012312.dooc Pis print.",0.4404,positive,0.2333333333333333,positive,1.0,topic_1,0.4387286126609645,0.4817788246576574,0.0794925626813781
272,87,Jake Sullivan,2012-07-04T04:00:00+00:00,Friday March AM Fw France UK behind Libya breakup Sid hrc libya breakupfrancetuk behind split docx This one strains credulity What do you think,"H <hrod17@clintonemailcom> Friday, March 9, 2012 7:40 AM 'sullivanjj@state.gov' Fw: H: France 8t UK behind Libya breakup. Sid hrc libya breakup.france8tuk behind split 030812.docx This one strains credulity. What do you think?",-0.29600000000000004,negative,-0.4,negative,1.0,topic_0,0.7321558735760985,0.194142384004371,0.0737017424195305
278,87,Jake Sullivan,2012-08-24T04:00:00+00:00,US Department of State Case No Doc No Date STATE DEPT PRODUCED TO HOUSE SELECT BENGHAZI COMM SUBJECT TO AGREEMENT ON SENSITIVE INFORMATION REDACTIONS NO FOIA WAIVER RELEASE IN PART,B6 U.S. Department of State Case No. F-2015-04841 Doc No. C05739885 Date: 05/13/2015 STATE DEPT. - PRODUCED TO HOUSE SELECT BENGHAZI COMM. SUBJECT TO AGREEMENT ON SENSITIVE INFORMATION & REDACTIONS. NO FOIA WAIVER. RELEASE IN PART B6,-0.34,negative,-0.033333333333333326,negative,1.0,topic_0,0.8478587206138045,0.06818868560848647,0.0839525937777091
282,87,Jake Sullivan,2012-08-28T04:00:00+00:00,Very interesting,Very interesting.,0.4576,positive,0.65,positive,1.0,topic_0,0.6583458310621032,0.16755026643042392,0.17410390250747293
285,87,Jake Sullivan,2012-09-11T04:00:00+00:00,If true this is encouraging Should consider passing to Israelis,"If true, this is encouraging. Should consider passing to Israelis.",0.7351,positive,0.35,positive,1.0,topic_0,0.7824016484115642,0.1088519277997214,0.1087464237887144
287,32,Cheryl Mills,2012-09-11T04:00:00+00:00,Tuesday September AM Huma Aleedin Request Can you get us copy of Bernard Henri Levis film about Libya think Harvey made it and showed it at Cannes last spring US Department of State Case No Doc No Date STATE DEPT PRODUCED TO HOUSE SELECT BENGHAZI COMM SUBJECT TO AGREEMENT ON SENSITIVE INFORMATION REDACTIONS NO FOIA WAIVER STATE CB,"H <hrod17@clintonernail.com> Tuesday, September 11, 2012 5:50 AM Huma Aleedin B6 Request Can you get us a copy of Bernard Henri-Levi's film about Libya? I think Harvey made it and showed it at Cannes last spring. U.S. Department of State Case No. F-2015-04841 Doc No. C05739894 Date: 05/13/2015 STATE DEPT. - PRODUCED TO HOUSE SELECT BENGHAZI COMM. SUBJECT TO AGREEMENT ON SENSITIVE INFORMATION & REDACTIONS. NO FOIA WAIVER. STATE-5CB0045227",-0.34,negative,-0.022222222222222216,negative,1.0,topic_0,0.8512697086382067,0.09248066375679134,0.05624962760500201
298,32,Cheryl Mills,2009-04-15T04:00:00+00:00,Ok,Ok.,0.29600000000000004,positive,0.5,positive,1.0,topic_1,0.16670708093985628,0.6665908045641527,0.166702114495991
300,32,Cheryl Mills,2009-04-16T04:00:00+00:00,Lets do Patsy Im ready,Let's do Patsy. I'm ready.,0.3612,positive,0.2,positive,1.0,topic_2,0.12609226261150072,0.14319548141906566,0.7307122559694336
301,116,Lauren Jiloty,2009-04-17T04:00:00+00:00,Sounds good,Sounds good.,0.4404,positive,0.7,positive,1.0,topic_2,0.1397062072781561,0.1413487348447881,0.7189450578770556
306,87,Jake Sullivan,2009-04-21T04:00:00+00:00,Lets just go,Let's just go w,0.0,neutural,0.0,neutural,1.0,topic_2,0.16758479200187784,0.17806528085338108,0.6543499271447409
306,264,jake.sullivar,2009-04-21T04:00:00+00:00,had asked for snapshot of statistics about Dept and AID facts and figures Can you have one for me this am so can see what else should be in it,I had asked for a snapshot of statistics about Dept and AID--facts and figures. Can you have one for me this am so I can see what else should be in it?,0.0,neutural,0.0,neutural,1.0,topic_2,0.19531698641614387,0.09761278841224913,0.707070225171607
309,81,Huma Abedin,2009-04-21T04:00:00+00:00,Ok to all,Ok to all.,0.29600000000000004,positive,0.5,positive,1.0,topic_1,0.16670708093985628,0.6665908045641527,0.166702114495991
312,81,Huma Abedin,2009-04-21T04:00:00+00:00,Will be called at,Will I be called at 9:15?,0.0,neutural,0.0,neutural,1.0,topic_0,0.3333333333333333,0.3333333333333333,0.3333333333333333
313,87,Jake Sullivan,2009-04-23T04:00:00+00:00,Thursday April AM JakeSullivar Testimony,"H <hrod17@clintonemail.com> Thursday, April 23, 2009 6:44 AM 'Jake.Sullivar Testimony",0.0,neutural,0.0,neutural,1.0,topic_2,0.12190704309086615,0.3848246404296146,0.4932683164795193
315,32,Cheryl Mills,2009-04-24T04:00:00+00:00,Have you discussed Bill Burns and Steve Bosworth,Have you discussed w Bill Burns and Steve Bosworth?,0.0,neutural,0.0,neutural,1.0,topic_0,0.6725076905250533,0.13705205024913536,0.1904402592258112
318,267,michele.fl,2009-04-27T04:00:00+00:00,Michele look forward to getting together to discuss number of issues Thanks for following up Jackie Newmyer Her email All the best Hillary,"Michele, I look forward to getting together to discuss a number of issues. Thanks for following up w Jackie Newmyer. Her email: All the best, Hillary",0.8126,positive,0.4,positive,1.0,topic_2,0.0749519984448609,0.08748916450187781,0.8375588370532614
319,32,Cheryl Mills,2009-04-28T04:00:00+00:00,Did you get anything from him See below,Did you get anything from him? See below.,0.0,neutural,0.0,neutural,1.0,topic_0,0.3333333333333333,0.3333333333333333,0.3333333333333333
320,32,Cheryl Mills,2009-04-28T04:00:00+00:00,Can we do tomorrow around,Can we do tomorrow around 9?,0.0,neutural,0.0,neutural,1.0,topic_1,0.16678692729473915,0.6634980493911113,0.16971502331414948
323,32,Cheryl Mills,2009-04-28T04:00:00+00:00,They are meeting at State so its easy to do We should schedule Lets discuss today,They are meeting at State so it's easy to do. We should schedule. Let's discuss today.,0.4902,positive,0.43333333333333335,positive,1.0,topic_2,0.1112810957952176,0.10643732742798608,0.7822815767767963
324,32,Cheryl Mills,2009-04-29T04:00:00+00:00,What are you thinking,What are you thinking?,0.0,neutural,0.0,neutural,1.0,topic_1,0.17204580446129872,0.6510476937758208,0.1769065017628805
325,32,Cheryl Mills,2009-05-02T04:00:00+00:00,Thats great,That's great!,0.6249,positive,0.8,positive,1.0,topic_1,0.17283852974270902,0.653627592978672,0.17353387727861905
326,81,Huma Abedin,2009-05-02T04:00:00+00:00,Are you at the planning meeting Holbrooke and Patraeus Also have you seen the readout from my Karzai call Has Holbrooke Whats the feedback,"Are you at the planning meeting w Holbrooke and Patraeus? Also, have you seen the readout from my Karzai call? Has Holbrooke? What's the feedback?",0.0,neutural,0.0,neutural,1.0,topic_1,0.09678312220194164,0.8005030156715953,0.102713862126463
327,87,Jake Sullivan,2009-05-02T04:00:00+00:00,How late could come tomorrow if you were able to move things would like to take the or shuttle or even later if possible,How late could I come tomorrow if you were able to move things? I would like to take the 11 or B6 12 shuttle or even later if possible.,0.3612,positive,0.05,positive,1.0,topic_1,0.08697790218924421,0.7874410795325809,0.12558101827817486
328,124,Lona Valmoro,2009-05-02T04:00:00+00:00,If we can clear schedule tomorrow thats best but dont want to offend the Armenians or Azeris Can you send me what Tues Fri would look like if we did that Also we have the Trilateral plus Lavrov,If we can clear schedule tomorrow that's best but I don't want to offend the Armenians or Azeris. Can you send me what Tues-Fri would look like if we did that? Also we have the Trilateral plus Lavrov,0.8248,positive,0.55,positive,1.0,topic_2,0.07047618652244253,0.09594492831340262,0.8335788851641549
329,124,Lona Valmoro,2009-05-03T04:00:00+00:00,Pls find copy of the movie Pray the Devil Back to Hell about the war in Liberia Add Gloria Steinem to my call list Pls find copy of the new Mary Pipher book Seeking Peace Chronicles of the Worst Buddhist in the World,"Pls find a copy of the movie ""Pray the Devil Back to Hell"" about the war in Liberia. Add Gloria Steinem to my call list. Pls find a copy of the new Mary Pipher book, ""Seeking Peace: Chronicles of the Worst Buddhist in the World.""",-0.9118,negative,-0.2878787878787879,negative,1.0,topic_1,0.07114773768816075,0.8555896927135865,0.0732625695982528
331,87,Jake Sullivan,2009-05-04T04:00:00+00:00,Do you know anything about this from any angle,Do you know anything about this--from any angle?,0.0,neutural,0.0,neutural,1.0,topic_2,0.14526368710661447,0.14492845079615485,0.7098078620972307
331,264,jake.sullivar,2009-05-04T04:00:00+00:00,Is he back in the country Does it need to be secure,Is he back in the country? Does it need to be secure?,0.34,positive,0.2,positive,1.0,topic_1,0.15072458099713731,0.7196236682111447,0.1296517507917181
332,116,Lauren Jiloty,2009-05-04T04:00:00+00:00,Monday May PM JakeSulliva Re Kazakhstan ii at Ok me India raised issues that this doesnt,"H <hrod17@clintonemail.com> Monday, May 4, 2009 4:08 PM 'Jake.Sulliva Re: Kazakhstan ii at Ok w me. India raised issues that this doesn't.",0.29600000000000004,positive,0.5,positive,1.0,topic_1,0.08650219340569207,0.8215396433651914,0.0919581632291166
333,274,habedin,2009-05-04T04:00:00+00:00,know sad,I know. S000 sad.,-0.4767,negative,-0.5,negative,1.0,topic_2,0.14294817241757618,0.14281827169731154,0.7142335558851122
